title,summary,url,publisher,image
"Galaxy Z Flip 7 looks a bit thinner in latest leaked image, but is it?","Samsung’s Galaxy Z Flip 7 is already going to be a big upgrade for its improved outer display, but it seems the device is also set to adopt a thinner overall profile based on the latest leaked image.



 more…",https://9to5google.com/2025/06/29/galaxy-z-flip-7-thinner-leak/,9to5Google,https://9to5google.com/wp-content/uploads/sites/4/2025/06/galaxy-z-flip-7-blass-4.jpg?quality=82&#038;strip=all&#038;w=1400
Galaxy Z Fold 7 leak shows thin unfolded design and return of hole punch camera,"Samsung’s Galaxy Z Fold 7 is quickly approaching its launch date, with the foldable breaking cover yet again this weekend with a new image showing off the thin design from a new angle, as well as reiterating the return of a hole punch camera.



 more…",https://9to5google.com/2025/06/28/galaxy-z-fold-7-leak-unfolded-hole-punch-camera/,9to5Google,https://9to5google.com/wp-content/uploads/sites/4/2025/06/fold-7-unfolded-blass-2.jpg?quality=82&#038;strip=all&#038;w=1326
Gmail for Android starts rolling out ‘mark as read’ button in notifications,"Google is making a notable quality-of-life improvement to Gmail notifications by adding a “Mark as read” button on Android.



 more…",https://9to5google.com/2025/06/28/gmail-mark-as-read-android/,9to5Google,https://9to5google.com/wp-content/uploads/sites/4/2023/12/gmail-android-2.jpg?quality=82&#038;strip=all&#038;w=1600
Where Google Wallet state IDs are available on Android,"States across the US are slowly rolling out support for adding your driver’s license or ID to the Google Wallet app on Android. 



 more…",https://9to5google.com/2025/06/28/google-wallet-state-ids/,9to5Google,https://9to5google.com/wp-content/uploads/sites/4/2023/03/google-wallet-logo-circle-2.jpg?quality=82&#038;strip=all&#038;w=1600
The Galaxy Z Flip 7’s new design will only matter if Samsung finally gives in,"With less than two weeks to go until Unpacked, every Galaxy Z Flip 7 leak seems to agree on one thing: Samsung is finally delivering on a larger cover screen for its 2025 flip phone. It’s what Samsung fans have been asking for since the Moto Razr+ launch last year — and the arrival of Motorola’s suc",https://9to5google.com/2025/06/28/galaxy-z-flip-7-new-design-only-matters-one-ui-changes/,9to5Google,https://9to5google.com/wp-content/uploads/sites/4/2024/07/Galaxy-Z-Flip-6-Cover-Display-1-10.jpg?quality=82&#038;strip=all&#038;w=1600
The best Google phones to buy in 2025 ahead of the Pixel 10 launch,We've tested all the Google Pixel phones available right now and these are the best ones for every kind of user.,https://www.zdnet.com/article/best-google-phone/,ZDNet,
I switched to a Wi-Fi-enabled smart lock with facial recognition - and can't go back,The Lockly Visage Zeno Series smart lock introduces groundbreaking technology - and backs it up with strong real-world performance.,https://www.zdnet.com/article/i-switched-to-a-wi-fi-enabled-smart-lock-with-facial-recognition-and-cant-go-back/,ZDNet,
Get a free Samsung Galaxy S25 Plus from T-Mobile with any trade-in - here's how,Trade in an eligible phone in any condition with a T-Mobile Experience Beyond or Go5G Next plan and get the Samsung Galaxy S25 Plus at no extra cost.,https://www.zdnet.com/article/t-mobile-will-give-you-a-free-samsung-galaxy-s25-plus-right-now-how-to-qualify-for-the-deal/,ZDNet,
This stuff is way better than super glue (and it's less messy),"Here's why you should be using UV resin instead for fixes, projects, and DIYs.",https://www.zdnet.com/article/this-stuff-is-way-better-than-super-glue-and-its-less-messy/,ZDNet,
Google just gave its Photos app the feature upgrade it deserves - here's what's new,"Here's what's new with the Ask Photos feature, plus how to opt out for good if you still dislike the AI feature.",https://www.zdnet.com/article/google-just-gave-its-photos-app-the-feature-upgrade-it-deserves-heres-whats-new/,ZDNet,
Tech Company Layoffs: The COVID Tech Bubble Bursts,"UPDATED 6/27/2025 -- As COVID drove everyone online, tech companies hired like crazy. Now we are hitting the COVID tech bust as tech giants shed jobs by the thousands. Check back regularly for updates to our tech layoffs tracker.",https://www.informationweek.com/it-leadership/tech-company-layoffs-the-covid-tech-bubble-bursts-sep-14,InformationWeek,https://eu-images.contentstack.com/v3/assets/blt69509c9116440be8/bltbf06263940b69a5e/668da1beeb4ff69673df3f17/BubbleBurst-Brian_Jackson-CFMK07-CP.jpg?width=1280&auto=webp&quality=80&disable=upscale
How to Untangle a Regulatory Compliance Mess,"When regulatory compliance gets messy, it's up to the CIO to fix the situation or face dire consequences. Here's how to straighten things out easily and quickly.",https://www.informationweek.com/data-management/how-to-untangle-a-regulatory-compliance-mess,InformationWeek,https://eu-images.contentstack.com/v3/assets/blt69509c9116440be8/blt4c6e44bb33814cf8/6859539a0edb925c79920027/complianceregulation_DenisPutilov-AlamyStockPhoto.jpg?width=1280&auto=webp&quality=80&disable=upscale
Navigating Generative AI's Expanding Capabilities and Evolving Risks,This session provides practical insights for harnessing generative AI's transformative potential while implementing appropriate safeguards.,https://www.informationweek.com/machine-learning-ai/navigating-generative-ai-s-expanding-capabilities-and-evolving-risks,InformationWeek,https://eu-images.contentstack.com/v3/assets/blt69509c9116440be8/blt84bda9746f690e81/685d93c0da1b7bed59fcc063/GenAI_Risks_by_Yuliya_Volkovska_via_Alamy_Stock_.jpg?width=1280&auto=webp&quality=80&disable=upscale
Shadow IT Isn’t Your Enemy -- It’s Your Secret Weapon,CIOs are no longer the gatekeepers of tech. The gate itself has collapsed. Here’s what you can do now.,https://www.informationweek.com/data-management/shadow-it-isn-t-your-enemy-it-s-your-secret-weapon,InformationWeek,https://eu-images.contentstack.com/v3/assets/blt69509c9116440be8/blt38ac1d4e9dcf7244/685ab14bac1886521c4f3c57/Shadow-Elly_Miller-alamy.jpg?width=1280&auto=webp&quality=80&disable=upscale
Business Volatility Requires a New Lens For Risk Management: Context Plus Control,The three E’s framework identifies sources of risk for business and technology leaders to regain control during unprecedented times of chaos.,https://www.informationweek.com/cyber-resilience/business-volatility-requires-a-new-lens-for-risk-management-context-plus-control,InformationWeek,https://eu-images.contentstack.com/v3/assets/blt69509c9116440be8/blt426eb13726fe5d04/685322821bf1f45e7dffba10/speed-motion-estherpoon-adobe-new.jpg?width=1280&auto=webp&quality=80&disable=upscale
Garena Free Fire Max Redeem Codes for June 29,"Garena Free Fire Max is one of the most popular games on the planet, and for...
The post Garena Free Fire Max Redeem Codes for June 29 appeared first on Fossbytes.",https://fossbytes.com/garena-free-fire-max-redeem-codes-for-june-29/,Fossbytes,
Garena Free Fire Max Redeem Codes for June 28,"Garena Free Fire Max is one of the most popular games on the planet, and for...
The post Garena Free Fire Max Redeem Codes for June 28 appeared first on Fossbytes.",https://fossbytes.com/garena-free-fire-max-redeem-codes-for-june-28/,Fossbytes,
Garena Free Fire Max Redeem Codes for June 27,"Garena Free Fire Max is one of the most popular games on the planet, and for...
The post Garena Free Fire Max Redeem Codes for June 27 appeared first on Fossbytes.",https://fossbytes.com/garena-free-fire-max-redeem-codes-for-june-27/,Fossbytes,
How To Pair & Reset Your Fire TV Stick Remote?,"Are you having trouble with your Fire TV Stick remote not responding? Or are you setting...
The post How To Pair &amp; Reset Your Fire TV Stick Remote? appeared first on Fossbytes.",https://fossbytes.com/how-to-pair-reset-your-fire-tv-stick-remote/,Fossbytes,
"How To Cancel Fortnite Crew Subscription: PC, PS5, XBOX, & More","Fortnite&#8217;s Crew subscription is a fantastic value, but if you&#8217;ve already made up your mind to...
The post How To Cancel Fortnite Crew Subscription: PC, PS5, XBOX, &amp; More appeared first on Fossbytes.",https://fossbytes.com/how-to-cancel-fortnite-crew-subscription-pc-ps5-xbox-more/,Fossbytes,
Floating Mini Panel GNOME Shell Extension,"GNOME Shell extensions make it easy to reshape the standard desktop layout in novel new ways, with add-ons like Dash to Panel, OpenBar, and Task Up provide options to combine, configure and customise the top panel. Now, another choice has drifted on to the scene: Floating Mini Panel. Floating Mini P",https://www.omgubuntu.co.uk/2025/06/floating-mini-panel-gnome-extension,OMG! Ubuntu,https://i0.wp.com/www.omgubuntu.co.uk/wp-content/uploads/2025/06/floating-mini-panel.jpg?resize=406%2C232&amp;ssl=1
Ubuntu 25.10 Snapshot 2 is Now Available to Download,"The second monthly snapshot of Ubuntu Questing Quokka (to become Ubuntu 25.10 when released in October 9) is now available.
You're reading Ubuntu 25.10 Snapshot 2 is Now Available to Download, a blog post from OMG! Ubuntu. Do not reproduce elsewhere without permission.",https://www.omgubuntu.co.uk/2025/06/ubuntu-25-10-snapshot-2-released,OMG! Ubuntu,https://i0.wp.com/www.omgubuntu.co.uk/wp-content/uploads/2022/05/kinetic-kudu-ubuntu-download.jpg?resize=406%2C232&amp;ssl=1
KDE Update Turns Off Potentially Seizure Triggering Effect,"KDE Plasma 6.4.1 turns off a visual desktop effect which could, in rare cases, post a risk of triggering seizures in users with photosensitive conditions. 
You're reading KDE Update Turns Off Potentially Seizure Triggering Effect, a blog post from OMG! Ubuntu. Do not reproduce elsewhere without perm",https://www.omgubuntu.co.uk/2025/06/kde-plasma-6-4-1-update-disables-a-seizure-triggering-effect,OMG! Ubuntu,https://i0.wp.com/www.omgubuntu.co.uk/wp-content/uploads/2025/06/kde-plasma-6.4-1.jpg?resize=406%2C232&amp;ssl=1
KDE Slick New ‘First Run’ Setup Tool Taking Shape,"KDE devs have revived the KISS setup tool, aiming to create a polished first-boot experience for Linux users to rival onboarding on Windows and macOS.
You're reading KDE Slick New &#8216;First Run&#8217; Setup Tool Taking Shape, a blog post from OMG! Ubuntu. Do not reproduce elsewhere without permis",https://www.omgubuntu.co.uk/2025/06/kde-initial-setup-tool-kiss-development-progress,OMG! Ubuntu,https://i0.wp.com/www.omgubuntu.co.uk/wp-content/uploads/2022/10/kde-logo.jpg?resize=406%2C232&amp;ssl=1
"Firefox 140 Brings Tab Unload, Custom Search & New ESR","Firefox 140 released with tab unloading, custom search engines, and more. ESR users gain major new features like tab grouping and vertical tabs.
You're reading Firefox 140 Brings Tab Unload, Custom Search &amp; New ESR, a blog post from OMG! Ubuntu. Do not reproduce elsewhere without permission.",https://www.omgubuntu.co.uk/2025/06/firefox-140-new-features-update,OMG! Ubuntu,https://i0.wp.com/www.omgubuntu.co.uk/wp-content/uploads/2025/06/firefox-140.jpg?resize=406%2C232&amp;ssl=1
"The Download: how to clean up AI data centers, and weight-loss drugs’ side effects","This is today&#8217;s edition of The Download, our weekday newsletter that provides a daily dose of what&#8217;s going on in the world of technology. This battery recycling company is now cleaning up AI data centers In a sandy industrial lot outside Reno, Nevada, rows of battery packs that once prop",https://www.technologyreview.com/2025/06/27/1119432/the-download-how-to-clean-up-ai-data-centers-and-weight-loss-drugs-side-effects/,MIT Technology Review,
We’re learning more about what weight-loss drugs do to the body,"Weight-loss drugs are this decade’s blockbuster medicines. Drugs like Ozempic, Wegovy, and Mounjaro help people with diabetes get their blood sugar under control and help overweight and obese people reach a healthier weight. And they’re fast becoming a trendy must-have for celebrities and other figu",https://www.technologyreview.com/2025/06/27/1119385/were-learning-more-about-what-weight-loss-drugs-do-to-the-body/,MIT Technology Review,
This battery recycling company is now cleaning up AI data centers,"In a sandy industrial lot outside Reno, Nevada, rows of battery packs that once propelled electric vehicles are now powering a small AI data center. Redwood Materials, one of the US’s largest battery recycling companies, showed off this array of energy storage modules, sitting on cinder blocks and w",https://www.technologyreview.com/2025/06/26/1119402/this-battery-recycling-company-is-now-cleaning-up-ai-data-centers/,MIT Technology Review,
"The Download: Google DeepMind’s DNA AI, and heatwaves’ impact on the grid","This is today&#8217;s edition of The Download, our weekday newsletter that provides a daily dose of what&#8217;s going on in the world of technology. Google’s new AI will help researchers understand how our genes work When scientists first sequenced the human genome in 2003, they revealed the full s",https://www.technologyreview.com/2025/06/26/1119379/the-download-google-deepminds-dna-ai-and-heatwaves-impact-on-the-grid/,MIT Technology Review,
"It’s officially summer, and the grid is stressed","It’s crunch time for the grid this week. As I’m writing this newsletter, it’s 100 °F (nearly 38 °C) here in New Jersey, and I’m huddled in the smallest room in my apartment with the shades drawn and a single window air conditioner working overtime.&#160;&#160; Large swaths of the US have seen brutal",https://www.technologyreview.com/2025/06/26/1119358/summer-grid-ai-air-conditioning/,MIT Technology Review,
"How Was the Wheel Invented? Computer Simulations Reveal Its Unlikely Birth Nearly 6,000 Years Ago","The wheel changed the course of history for all of humanity. But its invention is shrouded in mystery.
The post How Was the Wheel Invented? Computer Simulations Reveal Its Unlikely Birth Nearly 6,000 Years Ago appeared first on SingularityHub.",https://singularityhub.com/2025/06/28/how-was-the-wheel-invented-computer-simulations-reveal-its-unlikely-birth-nearly-6000-years-ago/,SingularityHub,https://singularityhub.com/uploads/2025/06/wooden_wheel.jpeg?auto=webp
Scientists Are Smuggling Large Drugs Into the Brain—Opening a New World of Possible Therapies,"New molecular shuttles can carry antibodies and enzymes to treat cancer and other brain diseases.
The post Scientists Are Smuggling Large Drugs Into the Brain—Opening a New World of Possible Therapies appeared first on SingularityHub.",https://singularityhub.com/2025/06/27/scientists-are-smuggling-large-drugs-into-the-brain-opening-a-new-world-of-possible-therapies/,SingularityHub,https://singularityhub.com/uploads/2025/06/brain-barrier.jpeg?auto=webp
The Dream of an AI Scientist Is Closer Than Ever,"The number of scientific papers relying on AI has quadrupled, and the scope of problems AI can tackle expands by the day.
The post The Dream of an AI Scientist Is Closer Than Ever appeared first on SingularityHub.",https://singularityhub.com/2025/06/26/the-dream-of-an-ai-scientist-is-closer-than-ever/,SingularityHub,https://singularityhub.com/uploads/2025/06/Screenshot-2025-06-22-at-10.53.03-AM-1.png?auto=webp
Cancer-Killing Immune Cells Can Now Be Engineered in the Body—With a Vaccine-Like Shot of mRNA,"Scientists are converting immune cells into super-soldiers that can hunt down and destroy cancer cells.
The post Cancer-Killing Immune Cells Can Now Be Engineered in the Body—With a Vaccine-Like Shot of mRNA appeared first on SingularityHub.",https://singularityhub.com/2025/06/24/cancer-killing-immune-cells-can-now-be-engineered-in-the-body-with-a-vaccine-like-shot-of-mrna/,SingularityHub,https://singularityhub.com/uploads/2025/06/human-t-cell-immune-system.jpeg?auto=webp
Will AI Take Your Job? It Depends on These 4 Key Advantages AI Has Over Humans,"This framework can help you understand where AI provides value.
The post Will AI Take Your Job? It Depends on These 4 Key Advantages AI Has Over Humans appeared first on SingularityHub.",https://singularityhub.com/2025/06/23/will-ai-take-your-job-it-depends-on-these-4-key-advantages-ai-has-over-humans/,SingularityHub,https://singularityhub.com/uploads/2025/06/hands-typing-on-a-computer-keyboard.jpeg?auto=webp
"Infinix Hot 60i Launched With MediaTek Helio G81 Ultimate SoC, 50-Megapixel Rear Camera","Infinix Hot 60i has launched in Bangladesh, as the first arrival in the upcoming Hot 60 lineup. This new smartphone boasts a 6.78-inch 120Hz LCD screen, a MediaTek Helio G81 SoC, and up to 256GB of storage. It features a 50-megapixel primary rear camera, and runs on a 5,160mAh battery.",https://www.gadgets360.com/mobiles/news/infinix-hot-60i-price-launch-sale-specifications-features-8785175#rss-gadgets-news,NDTV Gadgets 360,
OpenAI Said to Turn to Google's AI Chips to Power ChatGPT and Other Products,"OpenAI is said to be renting Google's AI chips for ChatGPT and other products. While a major Nvidia GPU purchaser, OpenAI is now utilising Google's Tensor Processing Units (TPUs) for both model training and inference. This move expands Google's external TPU availability, previously reserved for inte",https://www.gadgets360.com/ai/news/openai-google-ai-chips-to-power-products-8784261#rss-gadgets-news,NDTV Gadgets 360,
"Samsung Tipped to Unveil Tri-Fold Smartphone With Galaxy Z Fold 7, Z Flip 7; Launch Timeline Leaked","Samsung's first tri-fold smartphone might be unveiled alongside the Galaxy Z Fold 7 and Flip 7 at the July 9 Galaxy Unpacked event. A tipster claims that while the triple-folding phone might be teased on July 9, it is only expected to be available later this year. Huawei beat Samsung to launch the M",https://www.gadgets360.com/mobiles/news/samsung-tri-fold-smartphone-galaxy-unpacked-z-flip-7-8783205#rss-gadgets-news,NDTV Gadgets 360,
"iPhone 17 to Feature Slightly Larger Display Than iPhone 16, Tipster Claims","Apple's iPhone 17 model is tipped to feature a larger display than the current iPhone 16. Previous leaks also suggested a bigger iPhone 17 handset, which could match the iPhone 16 Pro's screen size. Additionally, the standard iPhone 17 display is anticipated to arrive with a 120Hz refresh rate later",https://www.gadgets360.com/mobiles/news/iphone-17-display-size-increase-leak-8782597#rss-gadgets-news,NDTV Gadgets 360,
Microsoft's Next-Gen AI Chip Production Reportedly Delayed to 2026,"Microsoft's next-gen Maia AI chip, codenamed Braga, reportedly faces a delay of at least six months, pushing mass production to 2026. A report by The Information reveals that this is due to design changes, staffing issues, and high turnover. Once released, the chip is expected to underperform Nvidia",https://www.gadgets360.com/ai/news/microsoft-next-gen-ai-chip-production-delayed-2026-report-8782057#rss-gadgets-news,NDTV Gadgets 360,
From convenience to risk: The hidden dangers of mobile apps,"Often positioned as a customer service tool, mobile apps now serve as live entry points into high-value financial ecosystems.",https://yourstory.com/2025/06/hidden-dangers-smartphone-mobile-apps-security-frauds,YourStory,
"Meesho gets shareholders' nod for Rs 4,250 Cr IPO: Report","Ahead of its IPO, social commerce company Meesho had recently completed its domicile shift from the US to India.",https://yourstory.com/2025/06/social-commerce-unicorn-meesho-ipo-shareholders-nod-rs-4250-crore,YourStory,
"Discovery, meaning, journeys: Artistic highlights from the India Art Festival in Hyderabad","In this photo essay series from Hyderabad, we showcase a range of art exhibits and creator insights.",https://yourstory.com/2025/06/discovery-meaning-journey-india-art-festival-hyderabad-creativity-photography,YourStory,
"Mygate elevates two senior leaders to strengthen tech, business functions",Mygate CEO Abhishek Kumar said the changes recognise the long-term contribution of both executives and align executive responsibilities with the company's current priorities.,https://yourstory.com/2025/06/mygate-elevates-two-senior-leadership-changes,YourStory,
Here are 3 godfathers of AI reshaping the world of artifical intelligence,"From neural networks to AI ethics, Hinton, Bengio, and LeCun have shaped the trajectory of artificial intelligence for decades.",https://yourstory.com/2025/06/3-godfathers-ai-hinton-bengio-lecun,YourStory,
"Indians spend 35 minutes each day wet cleaning their floors, says Dyson’s study","Dyson said that 62% of Indian respondents thought a vacuum cleaner with wet functionality would be the most effective method, yet they see that adoption remains quite low",https://www.thehindu.com/sci-tech/technology/indians-spend-35-minutes-each-day-wet-cleaning-their-floors-says-dysons-study/article69747777.ece,The Hindu - Technology,https://th-i.thgim.com/public/sci-tech/technology/57ltm8/article69747787.ece/alternates/LANDSCAPE_1200/WhatsApp%20Image%202025-06-26%20at%204.27.08%20PM.jpeg
Redmi Pad 2 Review | Suits users who want a tablet for routine daily tasks,"Redmi Pad 2, positioned as a sequel to the original Redmi Pad and Redmi Pad SE, aims to pack more power, features, and versatility, all while staying comfortably under the ₹20,000 bracket",https://www.thehindu.com/sci-tech/technology/gadgets/redmi-pad-2-review-suits-users-who-want-a-tablet-for-routine-daily-tasks/article69747696.ece,The Hindu - Technology,https://th-i.thgim.com/public/sci-tech/technology/gadgets/15l6ta/article69747698.ece/alternates/LANDSCAPE_1200/IMG_3242.JPG
Samsung launches Galaxy M36 5G with Exynos processor and AMOLED display in India,The South Korean electronics major has also introduced Galaxy AI features like Circle to Search and Gemini Live in Galaxy M36 5G,https://www.thehindu.com/sci-tech/technology/gadgets/samsung-launches-galaxy-m36-5g-with-exynos-processor-and-amoled-display-in-india/article69747635.ece,The Hindu - Technology,https://th-i.thgim.com/public/sci-tech/technology/gadgets/3jw037/article69747636.ece/alternates/LANDSCAPE_1200/WhatsApp%20Image%202025-06-27%20at%206.59.16%20PM.jpeg
Microsoft's next-gen AI chip production delayed to 2026: Report,"When the chip, code-named Braga, goes into production, it is expected to fall well short of the performance of Nvidia's Blackwell chip that was released late last year, the report said",https://www.thehindu.com/sci-tech/technology/microsofts-next-gen-ai-chip-production-delayed-to-2026-report/article69747367.ece,The Hindu - Technology,https://th-i.thgim.com/public/incoming/9hu9ev/article69747500.ece/alternates/LANDSCAPE_1200/2025-06-18T183709Z_1665568666_RC2MHDAVHMNU_RTRMADP_3_MICROSOFT-LAYOFFS.JPG
OpenAI turns to Google's AI chips to power its products,"The ChatGPT maker is one of the largest purchasers of Nvidia's graphics processing units (GPUs), using the AI chips to train models and also for inference computing, a process in which an AI model uses its trained knowledge to make predictions or decisions based on new information",https://www.thehindu.com/sci-tech/technology/openai-turns-to-googles-ai-chips-to-power-its-products/article69747366.ece,The Hindu - Technology,https://th-i.thgim.com/public/incoming/5jo980/article69747475.ece/alternates/LANDSCAPE_1200/2025-06-27T212609Z_1901662805_RC2LU7AVM1U0_RTRMADP_3_TECH-AI-OPENAI-ALPHABET.JPG
Should we be letting flies eat our food waste?,"In Lithuania and Australia, hungry fly larvae are used to process food waste into useful protein.",https://www.bbc.com/news/articles/cz9y1l397vno,BBC Technology,https://ichef.bbci.co.uk/ace/standard/240/cpsprodpb/776a/live/0a60bcb0-41ea-11f0-bace-e1270fc31f5e.jpg
'Made in the USA' reference disappears from Trump phone listing,"Trump Mobile maintains the gold smartphone will be made in the US, despite the  changed wording on its website.",https://www.bbc.com/news/articles/cy4yv3pmmwjo,BBC Technology,https://ichef.bbci.co.uk/ace/standard/240/cpsprodpb/db38/live/03f1bf40-52ad-11f0-90c3-576318da68e3.jpg
Pornhub to introduce 'government approved' age checks in UK,It is one of a number of porn sites which regulator Ofcom says will bring in tougher age verification for users.,https://www.bbc.com/news/articles/cr5v2lz5vl6o,BBC Technology,https://ichef.bbci.co.uk/ace/standard/240/cpsprodpb/4c1e/live/3dea5fb0-5265-11f0-bd3c-ef3c6f7203cb.jpg
Meta admits wrongly suspending Facebook Groups but denies wider problem,Group administrators have reported receiving automated messages which incorrectly say they have violated the rules.,https://www.bbc.com/news/articles/c3r9nwgvwy3o,BBC Technology,https://ichef.bbci.co.uk/ace/standard/240/cpsprodpb/753e/live/4d435e30-5274-11f0-9773-2789fa4a3c16.jpg
Three network phone calls down but data still working,"The phone operator said it was ""aware of an issue affecting voice services"" and apologised for disruption.",https://www.bbc.com/news/articles/cdxlqeyw95no,BBC Technology,https://ichef.bbci.co.uk/ace/standard/240/cpsprodpb/cc24/live/c42761c0-51ae-11f0-93b8-19c0eb10ae72.jpg
Mark Zuckerberg Ramps Up Meta’s A.I. Spending as Competition Heats Up,"Unhappy with his company’s artificial intelligence efforts, Meta’s C.E.O. is on a spending spree as he reconsiders his strategy in the contest to invent a hypothetical “superintelligence.”",https://www.nytimes.com/2025/06/27/technology/mark-zuckerberg-meta-ai.html,NY Times Tech,https://static01.nyt.com/images/2025/06/28/multimedia/00-biz-meta-ai-ZUCKERBERG-jlmc/00-biz-meta-ai-ZUCKERBERG-jlmc-mediumSquareAt3X-v2.jpg
"A.I. Frenzy Escalates as OpenAI, Amazon and Meta Supersize Spending","Companies like OpenAI, Amazon and Meta have supersized their spending on artificial intelligence, with no signs of slowing down.",https://www.nytimes.com/2025/06/27/technology/ai-spending-openai-amazon-meta.html,NY Times Tech,https://static01.nyt.com/images/2025/06/25/multimedia/00biz-ai-frenzy-kpwf/00biz-ai-frenzy-kpwf-mediumSquareAt3X.jpg
