title,summary,url,publisher,image
Uber in Talks With Travis Kalanick to Fund Self-Driving Car Deal,"The ride-hailing company is in talks to help Mr. Kalanick, who was forced out in 2017, buy an autonomous vehicles start-up as the robot taxi service Waymo gains momentum.",https://www.nytimes.com/2025/06/26/technology/uber-travis-kalanick-self-driving-car-deal.html,NY Times Tech,https://static01.nyt.com/images/2025/06/20/multimedia/00biz-uber-kfpg/00biz-uber-kfpg-mediumSquareAt3X.jpg
A.I. Is Starting to Wear Down Democracy,"Content generated by artificial intelligence has become a factor in elections around the world. Most of it is bad, misleading voters and discrediting the democratic process.",https://www.nytimes.com/2025/06/26/technology/ai-elections-democracy.html,NY Times Tech,https://static01.nyt.com/images/2025/06/26/business/DISINFO-AI/DISINFO-AI-mediumSquareAt3X.jpg
Interesting,A reporter who writes about A.I. finds her work is catching on — with the Chatbot she often writes about.,https://www.nytimes.com/2025/06/29/technology/why-is-chatgpt-telling-people-to-email-me.html,NY Times Tech,
A neural brain implant provides near instantaneous speech,Focusing on sound production instead of word choice makes for a flexible system.,https://arstechnica.com/science/2025/06/a-neural-brain-implant-provides-near-instantaneous-speech/,Ars Technica,https://cdn.arstechnica.net/wp-content/uploads/2025/06/Photo-BCI-participant-is-being-connected-to-the-BCI-system-by-researcher-Iacobacci-1152x648.jpg
"In a wild time for copyright law, the US Copyright Office has no leader",Rudderless Copyright Office has taken on new prominence during the AI boom.,https://arstechnica.com/tech-policy/2025/06/in-a-wild-time-for-copyright-law-the-us-copyright-office-has-no-leader/,Ars Technica,https://cdn.arstechnica.net/wp-content/uploads/2024/10/copyright-1152x648.jpg
Robotic sucker can adapt to surroundings like an actual octopus,Gripping and releasing irregular surfaces is harder than it might seem.,https://arstechnica.com/science/2025/06/robotic-sucker-can-adapt-to-surroundings-like-an-actual-octopus/,Ars Technica,https://cdn.arstechnica.net/wp-content/uploads/2025/06/GettyImages-2190249825-1152x648.jpg
SCOTUS upholds part of ACA that makes preventive care fully covered,"Cancer screenings, statins, vaccines, PrEP, will continue to be covered in full.",https://arstechnica.com/health/2025/06/critical-preventive-care-will-remain-free-under-aca-health-plans-scotus-rules/,Ars Technica,https://cdn.arstechnica.net/wp-content/uploads/2023/09/getty-supreme-court-1152x648.jpg
"After 27 years, engineer discovers how to display secret photo in Power Mac ROM",Developer solves mystery of hidden JPEG from the beige G3 era.,https://arstechnica.com/gadgets/2025/06/after-27-years-engineer-discovers-how-to-display-secret-photo-in-power-mac-rom/,Ars Technica,https://cdn.arstechnica.net/wp-content/uploads/2025/06/g3minitower-header-1152x648.jpg
"Carbon Record Reveals Evidence of Extensive Human Fire Use 50,000 Years Ago","""It has long been unclear when humans started using fire,"" writes Phys.org...


To address this question, researchers from the Institute of Oceanology of the Chinese Academy of Sciences (IOCAS), alongside collaborators from China, Germany, and France, analyzed the pyrogenic carbon record in a 300,00",https://science.slashdot.org/story/25/06/29/0142237/carbon-record-reveals-evidence-of-extensive-human-fire-use-50000-years-ago?utm_source=rss1.0mainlinkanon&utm_medium=feed,Slashdot,https://a.fsdn.com/sd/twitter_icon_large.png
Ask Slashdot: Do You Use AI - and Is It Actually Helpful?,"""I wonder who actually uses AI and why,"" writes Slashdot reader VertosCay:

Out of pure curiosity, I have asked various AI models to create: simple Arduino code, business letters, real estate listing descriptions, and 3D models/vector art for various methods of manufacturing (3D printing, laser prin",https://ask.slashdot.org/story/25/06/28/0521201/ask-slashdot-do-you-use-ai---and-is-it-actually-helpful?utm_source=rss1.0mainlinkanon&utm_medium=feed,Slashdot,https://a.fsdn.com/sd/twitter_icon_large.png
Mysterious Radio Burst Turns Out to Be From a Dead 1967 NASA Satellite,"An anonymous reader shared this report from Smithsonian magazine:
Last year, Australian scientists picked up a mysterious burst of radio waves that briefly appeared brighter than all other signals in the sky. Now, the researchers have discovered the blast didn't come from a celestial object, but a d",https://science.slashdot.org/story/25/06/29/0410213/mysterious-radio-burst-turns-out-to-be-from-a-dead-1967-nasa-satellite?utm_source=rss1.0mainlinkanon&utm_medium=feed,Slashdot,https://a.fsdn.com/sd/twitter_icon_large.png
New Linux Kernel Drama: Torvalds Drops Bcachefs Support After Clash,"Bcachefs ""pitches itself as a filesystem that 'doesn't eat your data',"" writes the open source/Linux blog It's FOSS. Although it was last October that Bcachefs developer Kent Overstreet was restricted from participating in the Linux 6.13 kernel development cycle (after ending a mailing list post wit",https://linux.slashdot.org/story/25/06/29/0248236/new-linux-kernel-drama-torvalds-drops-bcachefs-support-after-clash?utm_source=rss1.0mainlinkanon&utm_medium=feed,Slashdot,https://a.fsdn.com/sd/twitter_icon_large.png
AI Improves At Improving Itself Using an Evolutionary Trick,"Technology writer Matthew Hutson (also Slashdot reader #1,467,653) looks at a new kind of self-improving AI coding system. It rewrites its own code based on empirical evidence of what's helping &mdash; as described in a recent preprint on arXiv. 

From Hutson's new article in IEEE Spectrum:



A Dar",https://slashdot.org/story/25/06/28/2314203/ai-improves-at-improving-itself-using-an-evolutionary-trick?utm_source=rss1.0mainlinkanon&utm_medium=feed,Slashdot,https://a.fsdn.com/sd/twitter_icon_large.png
