title,summary,url,publisher,image,category,full_story
360 Million Indians Just Got Premium AI Chatbots For Free For a Year,"Perplexity has partnered with Indian telecoms giant Bharti Airtel to provide its premium Pro service to 360 million customers for free for an entire year, representing the largest distribution deal of its kind globally. 

The service normally costs $200 annually and provides access to advanced model",https://slashdot.org/story/25/07/17/0742246/360-million-indians-just-got-premium-ai-chatbots-for-free-for-a-year?utm_source=rss1.0mainlinkanon&utm_medium=feed,Slashdot,https://a.fsdn.com/sd/twitter_icon_large.png,Technology,"Perplexity has partnered with Indian telecoms giant Bharti Airtel to provide its premium Pro service to 360 million customers for free for an entire year , representing the largest distribution deal of its kind globally.The service normally costs $200 annually and provides access to advanced models including GPT-4.1 and Claude Sonnet and Opus 4. India is already ChatGPT's largest market by mobile usage."
VMware Reboots Its Partner Program Again With New Invite-Only Program,"VMware is overhauling its partner program again under Broadcom's direction, drastically reducing the number of authorized partners -- especially small and mid-size ones -- while ending the white label program by October 31, 2025. The Register reports: Australian IT service provider Interactive outli",https://tech.slashdot.org/story/25/07/16/236216/vmware-reboots-its-partner-program-again-with-new-invite-only-program?utm_source=rss1.0mainlinkanon&utm_medium=feed,Slashdot,https://a.fsdn.com/sd/twitter_icon_large.png,Technology,"VMware is overhauling its partner program again under Broadcom's direction, drastically reducing the number of authorized partners -- especially small and mid-size ones -- while ending the white label program by October 31, 2025. The Register reports:VMware also told The Register that ""Non-renewing partners can continue to support their existing customers until the end of their current commit contract term including co-termed capacity orders. Non-renewing partners are encouraged to work with authorized VCSP partners to ensure a smooth transition for customers who seek to renew a service at the end of their current term.""Making matters worse: VMware on Tuesday divulged three critical flaws in eights of its products rated 9.3/10."
"Permit for xAI’s data center blatantly violates Clean Air Act, NAACP says","Evidence suggests health department gave preferential treatment to xAI, NAACP says.",https://arstechnica.com/tech-policy/2025/07/permit-for-xais-data-center-blatantly-violates-clean-air-act-naacp-says/,Ars Technica,https://cdn.arstechnica.net/wp-content/uploads/2025/07/GettyImages-2217034105-1024x648.jpg,Technology,"xAI continues to face backlash over its Memphis data center, as the NAACP joined groups today appealing the issuance of a recently granted permit that the groups say will allow xAI to introduce major new sources of pollutants without warning at any time.

The battle over the gas turbines powering xAI's data center began last April when thermal imaging seemed to show that the firm was lying about dozens of seemingly operational turbines that could be a major source of smog-causing pollution. By June, the NAACP got involved, notifying the Shelby County Health Department (SCHD) of its intent to sue xAI to force Elon Musk's AI company to engage with community members in historically Black neighborhoods who are believed to be most affected by the pollution risks.

But the NAACP's letter seemingly did nothing to stop the SCHD from granting the permits two weeks later on July 2, as well as exemptions that xAI does not appear to qualify for, the appeal noted. Now, the NAACP—alongside environmental justice groups; the Southern Environmental Law Center (SELC); and Young, Gifted and Green—is appealing. The groups are hoping the Memphis and Shelby County Air Pollution Control Board will revoke the permit and block the exemptions, agreeing that the SCHD's decisions were fatally flawed, violating the Clean Air Act and local laws.

SCHD's permit granted xAI permission to operate 15 gas turbines at the Memphis data center, while the SELC's imaging showed that xAI was potentially operating as many as 24. Prior to the permitting, xAI was accused of operating at least 35 turbines without the best-available pollution controls.

In their appeal, the NAACP and other groups argued that the SCHD put xAI profits over Black people's health, granting unlawful exemptions while turning a blind eye to xAI's operations, which allegedly started in 2024 but were treated as brand new in 2025."
Steam cracks down on some sex games to appease payment processors,"New rule against ""certain kinds"" of adult content accompanies removal of ""incest"" games.",https://arstechnica.com/gaming/2025/07/steam-cracks-down-on-some-sex-games-to-appease-payment-processors/,Ars Technica,https://cdn.arstechnica.net/wp-content/uploads/2025/07/incest-1152x648-1752693482.png,Technology,"Valve's famously permissive rules for what games are and are not allowed on Steam got a little less permissive this week, seemingly in response to outside pressure from some of its partner companies. In a Tuesday update to the ""Rules and Guidelines"" section of Steam's Onboarding Documentation, the company added a new rule prohibiting ""Content that may violate the rules and standards set forth by Steam’s payment processors and related card networks and banks, or Internet network providers. In particular, certain kinds of adult only content.""

On its own, the new rule seems rather vague, with no details on which of the many kinds of ""adult only content"" would belong in the ""certain"" subset prohibited by these unnamed payment processors and ISPs. But the trackers over at SteamDB noticed that the publication of the new rule coincides with the removal of dozens of Steam games whose titles make reference to incest, along with a handful of sex games referencing ""slave"" or ""prison"" imagery.

Holding the keys to the bank

Valve isn't alone in having de facto restrictions on content imposed on it by outside payment processors. In 2022, for instance, Visa suspended all payments to Pornhub's ad network after the adult video site was accused of profiting from child sexual abuse materials. And PayPal has routinely disallowed payments to file-sharing sites and VPN providers over concerns surrounding piracy of copyrighted materials."
Google finds custom backdoor being installed on SonicWall network devices,"Overstep backdoor nukes key log entries, making detection hard.",https://arstechnica.com/security/2025/07/google-finds-custom-backdoor-being-installed-on-sonicwall-network-devices/,Ars Technica,https://cdn.arstechnica.net/wp-content/uploads/2023/07/exploit-vulnerability-security.jpg,Technology,"Researchers from the Google Threat Intelligence Group said that hackers are compromising SonicWall Secure Mobile Access (SMA) appliances, which sit at the edge of enterprise networks and manage and secure access by mobile devices.

The targeted devices are end of life, meaning they no longer receive regular updates for stability and security. Despite the status, many organizations continue to rely on them. That has left them prime targets by UNC6148, the name Google has given to the unknown hacking group.

“GTIG recommends that all organizations with SMA appliances perform analysis to determine if they have been compromised,” a report published Wednesday said, using the abbreviation for Google Threat Intelligence Group. “Organizations should acquire disk images for forensic analysis to avoid interference from the rootkit anti-forensic capabilities. Organizations may need to engage with SonicWall to capture disk images from physical appliances.”

Lacking specifics

Many key details remain unknown. For one thing, the attacks are exploiting leaked local administrator credentials on the targeted devices, and so far, no one knows how the credentials were obtained. It’s also not known what vulnerabilities UNC6148 is exploiting. It’s also unclear precisely what the attackers are doing after they take control of a device.

The lack of details is largely the result of the functioning on Overstep, the name of custom backdoor malware UNC6148 is installing after initial compromise of the devices. Overstep allows the attackers to selectively remove log entries, a technique that is hindering forensic investigation. Wednesday’s report also posits that the attackers may be armed with a zero-day exploit, meaning it targets a vulnerability that’s currently publicly unknown. Possible vulnerabilities UNC6148 may be exploiting include:"
"2026 Mercedes-Benz CLA feels like a real car, not a science experiment","Mercedes' new 800 V electric powertrain is ready for the public, and we've driven it.",https://arstechnica.com/cars/2025/07/2026-mercedes-benz-cla-feels-like-a-real-car-not-a-science-experiment/,Ars Technica,https://cdn.arstechnica.net/wp-content/uploads/2025/07/25C0172_009-1152x648.jpg,Technology,"Mercedes provided flights from Detroit to Copenhagen, Denmark, and accommodation so Ars could drive the CLA with EQ Technology. Ars does not accept paid editorial content.

The Mercedes-Benz CLA is a marked departure from Mercedes' EV efforts. Instead of a dedicated line of EQ vehicles—like the EQB, EQC, and EQS—we're getting vehicles ""with EQ Technology."" It started with the electric G Wagon, but the CLA is the first mainstream product to make the change. The thing is that the change is significant and for the better. Several months ago, we got some time in a prototype CLA; now we've driven the final product.

The CLA returns for the 2026 model year as an EV first (with a hybrid coming) on an all-new 800-volt architecture. This architecture will find its way to other Mercedes vehicles, like the upcoming GLB and GLC. This thoroughly modern setup features some of the company's biggest innovations.

The CLA will be available with either one or two electric motors, with a two-speed setup for efficiency and performance. The 250+ base model makes 268 hp (200 kW) and 247 lb-ft (335 Nm) of torque. Mercedes is claiming up to 792 km of range with this model on the WLTP cycle. Accounting for WLTP's optimism, it's still possible we might see an EPA-rated range over 400 miles, but Mercedes isn't quoting any real numbers yet.

Mercedes-Benz Not quite a sedan, more like a four-door coupe. Not quite a sedan, more like a four-door coupe. Mercedes-Benz Mercedes-Benz The CLA rides well. The CLA rides well. Mercedes-Benz Mercedes-Benz It's not a performance car, but it's no slouch either. It's not a performance car, but it's no slouch either. Mercedes-Benz The CLA rides well. Mercedes-Benz It's not a performance car, but it's no slouch either. Mercedes-Benz

The dual motor, all-wheel drive 4Matic variant, makes 349 hp ( 260 kW) and 380 lb-ft (515 Nm) of torque. It also has a two-speed setup. The WLTP estimate from Mercedes here is up to 771 km, which would still be potentially 400 mil"
More VMware cloud partners axed as Broadcom launches new invite-only program,Smaller businesses most likely to be affected as white-label cloud program is also ending.,https://arstechnica.com/information-technology/2025/07/more-vmware-cloud-partners-axed-as-broadcom-launches-new-invite-only-program/,Ars Technica,https://cdn.arstechnica.net/wp-content/uploads/2025/07/GettyImages-1755494482-1152x648.jpg,Technology,"Broadcom is kicking some cloud service providers (CSPs) out of the VMware channel partner program, bringing uncertainty for the technological and financial futures of numerous businesses, especially small-to-medium-sized ones.

As reported by The Register today, Broadcom this week revealed to VMware CSP partners that it is launching a new invite-only channel program for CSPs on November 1. Fewer CSPs are expected to be eligible for this new program. The Register said that “some mid-size partners won’t be invited to the new program.""

Current VMware CSPs that didn’t receive an invite for the new program by today have reportedly been cut and will receive a notice of non-renewal.

CSPs that are getting booted are allowed to continue conducting business as normal until October 31. Afterward, those CSPs and the organizations whose VMware-based deployments they serve will be heavily impacted. As explained by Australian IT service provider and VMware CSP Interactive, companies currently using VMware tech through a CSP that's being cut will have to find a new way to renew VMware licenses and may see “delays or confusion” amid service and renewal requests and changes to the support and service they receive. Furthermore, prices could go up since partner consolidation could lead to “additional costs for migration and re-onboarding and reduced bundling options that previously allowed for greater cost efficiencies,” Interactive said.

White-label program ending

Since acquiring VMware, Broadcom has been shrinking the number of businesses that are eligible to resell and provide support for VMware offerings. In January 2024, it replaced the old VMware partner program with an invite-only one, the Broadcom Advantage Partner Program, and shed many partners. Broadcom also cut business ties with many CSP partners by requiring CSP members of its new partner program to operate at least 3,500 processor cores. In March 2024, The Register reported that “hundreds” of CSPs weren’t invited to "
"Plasma Bigscreen, KDE’s TV Interface, is Back on Air","KDE's Plasma Bigscreen TV UI gets rebooted with slicker visuals, search functionality, and more – thanks to one developer tuning in to its potential.
You're reading Plasma Bigscreen, KDE&#8217;s TV Interface, is Back on Air, a blog post from OMG! Ubuntu. Do not reproduce elsewhere without permission",https://www.omgubuntu.co.uk/2025/07/plasma-bigscreen-revival-kde-tv,OMG! Ubuntu,https://i0.wp.com/www.omgubuntu.co.uk/wp-content/uploads/2025/07/kdetv.jpg?resize=406%2C232&amp;ssl=1,Technology,"Most fresh graduates could be forgiven for taking time out to rest, relax and defrag their post-study mind, but one comp-sci student decided to devote their downtime by reviving KDE’s TV-focused front-end — and the results look great!

Plasma Bigscreen is a shell designed for use on televisions and other large displays, using a remote for navigation rather than mouse or keyboard. It’s been around for a while (I wrote about it in 2022) but if I’m frank—I’m not, I’m Joey—I’d forgotten it existed.

KDE developer Espi, a regular contributor to Plasma Mobile, had not.

But he found the project in a state of limbo. Though ported to Plasma 6, Bigscreen had seen scant development in the years since and had been dropped from the main Plasma release cycle and from the package repos of most Linux distributions.

In a detailed blog post Espi says that upon seeing this dearth in development effort he “sensed an opportunity” to do something about it, and decided to “take a swing at improving the project” over the course of a week.

And its new programming makes for some must-see TV.

Plasma Bigscreen Sees a Big Refresh

Original image: Espi

Espi’s big Bigscreen revamp brings the home screen UI much closer to the original Breeze Ocean mockups, with a cleaner, flatter design, a dynamically expanding clock widget, and a KRunner-based search tools to make finding and launching apps faster.

The Settings interface was rejigged, now sporting a sidebar layout, using vertical scrolling stacks for toggles and content, and making use of a custom-made component library (which other contributors and developers can use) for building TV-focused UIs.

The newer, KODI-esque approach works well

Beyond what’s visible on screen are extensive changes under the hood, ranging from QML library updates and module fixes to greater use of tools and other Plasma components.

All of it is real, working code.

Espi tested the work on his television by compiling Bigscreen on postmarketOS and running it off "
Blender 4.5 LTS Released with ‘Full Vulkan Support’,"The new Blender 4.5 LTS release features major improvements, including full Vulkan support, faster startup, new Geometry Nodes, HDR and more. 
You're reading Blender 4.5 LTS Released with &#8216;Full Vulkan Support&#8217;, a blog post from OMG! Ubuntu. Do not reproduce elsewhere without permission.",https://www.omgubuntu.co.uk/2025/07/blender-4-5-lts-vulkan-support,OMG! Ubuntu,https://i0.wp.com/www.omgubuntu.co.uk/wp-content/uploads/2019/07/cropped-blender-software-logo-1.jpg?resize=406%2C232&amp;ssl=1,Technology,"Blender 4.5 is out, serving as the latest Long Term Support (LTS) release of the much-revered cross-platform 3D modelling and animation suite.

While a lot of hype has been generated over features planned for Blender 5.0, the the Blender 4.5 change-log is by no means meek, offering a mix of performance, usability and tooling tweaks.

“With 2 years of updates, full Vulkan support, and quality-of-life improvements, Blender 4.5 LTS is every Blenderhead’s best friend,” the launch page states.

The promise of full Vulkan support ‘on par with OpenGL’ is the big draw in this release, gaining support for more features on Windows/Linux like OpenXR, Subdivision, and USD/Hydra. Limitations remain, and it is not enabled by default – flicking a switch in Preferences required.

If trying the Vulkan backend in Blender 4.5 on Linux, those with AMD GPUs are advised to use Mesa 25.3 (or newer)—FYI: Ubuntu 24.04 is getting Mesa 25.0.7 as a HWE update—and Linux users with NVIDIA GPUs need driver version 550 or higher.

Other changes and additions in Blender 4.5 LTS:

New Geometry Nodes focused on data access and string handling

New Grease Pencil nodes have been added

Denoise node now supports GPU devices

Procedural texture nodes now available in the Compositor

“Boundary Strokes” renamed “Fill Guides”

Option to only show onion skinning for the active object in Viewport

SVG exporter can now export animations

Multi-threaded shader compilation enabled by default

Liquid simulation performance improved by 1.25x – 1.5x

Playhead element snapping available in all timeline editors

Video Sequencer supports HDR

Faster texture loading in EEVEE

New shadow terminator bias

Support for writing ProRes codec videos

User interface buffs, including large cursors for HiDPI on Linux

As for all recent releases, anyone looking to learn more can watch a video recap from Blender which highlights the key changes. Detailed release notes are available for those who prefer to read.

For macOS users, B"
"Kiro, Amazon-Backed Agentic IDE, Enters Public Preview","Kiro, a new AI-powered IDE for Linux, macOS, and Windows, is now in public preview. Learn about its ""spec-driven"" workflow and VS Code compatibility.
You're reading Kiro, Amazon-Backed Agentic IDE, Enters Public Preview, a blog post from OMG! Ubuntu. Do not reproduce elsewhere without permission.",https://www.omgubuntu.co.uk/2025/07/kiro-ai-ide-public-preview-linux,OMG! Ubuntu,https://i0.wp.com/www.omgubuntu.co.uk/wp-content/uploads/2025/07/kiro-logo.jpg?resize=406%2C232&amp;ssl=1,Technology,"Kiro, a new AI-powered Integrated Development Environment (IDE) built on the open-source foundation of VS Code by a team from Amazon, is now available in preview for Windows, macOS and Linux.

Similar to tools like Warp, OpenAI’s Codex, and ‘vibe coding’ darling Cursor, Kiro integrates AI agents into the development workflow as an AI pair programmer not only able to turn ideas into production-ready code but handle mundane and routine tasks too.

Rather than immediately generate code from a raw prompt, Kiro will turn the request into a “spec” in which requirements, design, and tasks are laid out before code is written, a process Kiro’s developers describe as going from “vibe coding to viable code”.

Vibe coding or guide coding, your choice

Once the “spec”, a living and updatable document, is good to go, Kiro breaks the feature request down into a sequence of tasks and sub-tasks. Again, developers get to audit, refine and monitor this before and during action.

Kiro also uses “hooks”. These are event-driven automations which trigger on specific actions, like saving a file or committing code to a repo. Hooks can be used to generate documentation, update APIs, run security checks, check for errors, and so on.

AI coding and agentic workflows are becoming ever-more common. In any skills market, keeping pace with trends is a pragmatic necessity: employers are hiring fewer people due to expectations AI will make a smaller group of developers “more productive” (even if stats don’t back that up).

“Through Kiro, we reinvented how developers work with AI agents. We pioneered spec-driven development, where Kiro turns your prompt into structured requirements, design, and tasks that are then implemented by agents,” the team, working within Amazon Web Services (AWS), says.

Beyond specs and hooks, Kiro supports the Model Context Protocol for specialised tools, steering rules for AI behaviour, and (naturally) includes an embedded chatbot mode for questions (albeit with file and d"
Ubuntu 25.10 Fixes Something You Didn’t Know Needed Fixing,"Another bug to file under 'once you see it, you can't unseen it' has been fixed in Ubuntu, this one concerning the curved corners on the desktop dock.
You're reading Ubuntu 25.10 Fixes Something You Didn&#8217;t Know Needed Fixing, a blog post from OMG! Ubuntu. Do not reproduce elsewhere without per",https://www.omgubuntu.co.uk/2025/07/ubuntu-25-10-gives-the-dock-a-rounder-radii,OMG! Ubuntu,https://i0.wp.com/www.omgubuntu.co.uk/wp-content/uploads/2025/07/fix-over.jpg?resize=406%2C232&amp;ssl=1,Technology,"Name: Ubuntu Dock radii.

Age: Brand new(ish).

Appearance: Ever-so-slightly rounder.

What’s this about? When Ubuntu Dock is in dock mode (not full width), corner radii are out of whack with the corner radius used elsewhere. Padding around Yaru icons (and their hover effect) is also slightly off. A community designer noticed these issue, contributed a fix, and that fix will ship in Ubuntu 25.10 in October. *mic drop, exits stage, world stunned*.

Once seen, can’t be unseen!

That’s… it? That’s it, but drop the mock shock, yeah? You are reading OMG! Ubuntu, after all – a site founded on covering minute changes in desktop Linux docks!

How rounder are corners now? Well, the CSS fix bumps the dock’s border radii up from * 1.5 to * 3 , so they are now 2x as round as they were, if that in any way makes this news sound a little more consequential…

It doesn’t. Fair enough. The original issue is “technically unnoticeable” by most, since the Ubuntu Dock is in panel mode out of the box. For those who do use it floating, having consistent curves through the UI could aid those cushy, subconscious “something feels right” vibes that other OSes have. That is good, right?

Hmm… Okay: there’s nothing wrong with people paying obsessive attention to detail in Linux UIs. The eagle-eyed user who spotted this inconsistency has form: he noticed some of Ubuntu’s icons used optically incorrect proportions. Then as now, he didn’t simply point the issues out, he got stuck in and fixed them. Team work is dream work!

Any actual upside to this? You will finally be able to use Ubuntu on your laptop in hipster coffee shops without fear of getting disapproving glares from Figma types, hunched over their MacBooks. Well, you would if that actually happened.

Any likely downsides? The 3 people who noticed the issue but didn’t mind it will now have to adapt. There’s also the chance that the YouTube drama industrial complex will fire up to fire off “Ubuntu Did WHAT?!” content, replete with shocked th"
