title,summary,url,publisher,image,category,full_story
"Mistral’s Voxtral goes beyond transcription with summarization, speech-triggered functions","Mistral's open-source speech model Voxtral can recognize multiple languages, understand spoken instructions and also offer enterprise security.",https://venturebeat.com/ai/mistrals-voxtral-goes-beyond-transcription-with-summarization-speech-triggered-functions/,VentureBeat,,Technology,"Want smarter insights in your inbox? Sign up for our weekly newsletters to get only what matters to enterprise AI, data, and security leaders. Subscribe Now

Mistral released an open-sourced voice model today that could rival paid voice AI, such as those from ElevenLabs and Hume AI, which the company said bridges the gap between proprietary speech recognition models and the more open, yet error-prone versions.

Voxtral, which Mistral will release under an Apache 2.0 license, is available in a 24B parameter version and a 3B variant. The larger model is intended for applications at scale, while the smaller version would work for local and edge use cases.

Introducing the world's best (and open) speech recognition models! pic.twitter.com/tUnPcdCrbZ — Mistral AI (@MistralAI) July 15, 2025

“Voice was humanity’s first interface—long before writing or typing, it let us share ideas, coordinate work, and build relationships. As digital systems become more capable, voice is returning as our most natural form of human-computer interaction,” Mistral said in a blog post. “Yet today’s systems remain limited—unreliable, proprietary, and too brittle for real-world use. Closing this gap demands tools with exceptional transcription, deep understanding, multilingual fluency, and open, flexible deployment.”

Voxtral is available on Mistral’s API and a transcription-only endpoint on its website. The models are also accessible through Le Chat, Mistral’s chat platform.

The AI Impact Series Returns to San Francisco - August 5 The next phase of AI is here - are you ready? Join leaders from Block, GSK, and SAP for an exclusive look at how autonomous agents are reshaping enterprise workflows - from real-time decision-making to end-to-end automation. Secure your spot now - space is limited: https://bit.ly/3GuuPLF

Mistral said that speech AI “meant choosing between two trade-offs,” pointing out that some open-source automated speech recognition models often had limited semantic understanding"
Apple News+ adds a new game that uses emoji and Genmoji to sovle puzzles,"Released to coincide with World Emoji Day, the new Emoji Game is part logic, part word game that's inspired by how we use emojis to communicate.",https://techcrunch.com/2025/07/16/apple-news-adds-a-new-game-that-uses-emoji-and-genmoji-to-sovle-puzzles/,TechCrunch,,Technology,"Apple is introducing a new reason to upgrade to its subscription news offering, Apple News+: more games. On Thursday, the company announced the addition of the Emoji Game, an original title that will join its other games, including its Crossword puzzle, Crossword Mini, Sudoku, and word game Quartiles, in both the U.S. and Canada in English.

Bundling games with other services has proven a successful strategy to attract users and keep them engaged, as The New York Times and even LinkedIn have discovered. Apple won’t share its user numbers around Games, but it says that many people subscribe to News+ just for the puzzles.

Image Credits:Apple

Released to coincide with World Emoji Day, the new Emoji Game is part logic, part word game that’s inspired by how we use emojis to communicate with one another. In this daily game, players try to solve phrases using emojis with the goal of completing the puzzle in the least number of moves possible.

For instance, if the word “appear” showed up in the puzzle, you might see the letters “ap” followed by four blank spaces. Then, you’d drag the emoji for the pear up into the blanks to complete the word. Of course, the phrases in the Emoji Game will be a bit harder to guess. Plus, the emoji you need to solve the puzzle will often be found in emoji combinations or those that involve a bit of abstract thinking to come up with the answer. The word for the emoji may also be used to fill in blank spaces that have other letters in between them.

If you’re stumped, you can unveil a clue below the phrase, but this will cost you one of your moves.

Image Credits:Apple

There are multiple phrases to solve each day to complete the full puzzle. Finishing in six moves is considered a perfect score, and leaderboards help you track your streaks and how your scores compare with friends and other users. In the upcoming iOS 26, you’ll be able to challenge friends to play with you using the new Games app.

To make the game more Apple-specific, it also"
Manidhargal Now Available for Streaming on Aha Tamil: Everything You Need to Know About Tamil Thriller,"Watch Manidhargal, the Tamil psychological thriller directed by Raam Indhra, streaming on Aha Tamil from July 17, 2025. Follow six friends as panic, guilt, and survival instincts unfold after a mysterious incident that changes their lives forever.",https://www.gadgets360.com/entertainment/news/manidhargal-now-available-for-streaming-on-aha-tamil-8892789#rss-gadgets-news,NDTV Gadgets 360,,India,"Manidhargal is a Tamil thriller film which is based on the psychological unwinding of six friends after a disturbing and unexpected incident that changes their lives. Raam Indhra directed this movie, and it involves the night when the friends drink, and they get into a chaotic and disturbed morning when the group get up in the morning to a cryptic, troubled scene. The panic sets in among every character, and they react differently, which unveils the inner fears, desperation and guilt.

When and Where to Watch Manidhargal

This Tamil thriller is now heading to the digital platform after its theatrical release on May 30, 2025. It is available on Aha Tamil from July 17, 2025, following its digital premiere.

Trailer and Plot of Manidhargal

The trailer gives you a glimpse of a dark night theme where six fiends are in the car and drinking. They run into a tense environment as they wake up the next morning. There is chaos, violence and drama in the film that keeps the viewers clutched to their seats. The plot revolves around their friendship and the mysterious events that take place one by one. Their moral dilemmas collide with their survival instincts. The narrative of the film mainly focuses on suspense and emotional intensity, together with themes of trust and friendship being questioned.

Cast and Crew of Manidhargal

The film has Kapil Velavan and Daksha as the protagonists with Arjun Dev Saravanan, Sambasivam M K and Gunavanthan in the supporting roles. It is a joint production by Studio Moving Turtle and Sri Krish Pictures, created by Rajendra Prasad, Sambasivam M K and J Naveen Kumar.

Reception and Buzz of Manidhargal

The movie has driven blended views from the critics and audience for its tense and emotional narrative. There was a lot of buzz on social media about the unique concept and it gained 9 rating on IMDb out of 10."
Beeper’s all-in-one messaging app relaunches with an on-device model and premium upgrades,"Multi-service messaging app Beeper, which allows people to connect to all their chat apps from one interface, is relaunching its app on Wednesday to offer a more secure version that no longer requires use of its own cloud services.",https://techcrunch.com/2025/07/16/beepers-all-in-one-messaging-app-relaunches-with-an-on-device-model-and-premium-upgrades/,TechCrunch,,Technology,"Multi-service messaging app Beeper, which allows people to connect to all their chat apps from one interface, is relaunching its app on Wednesday to offer a more secure version that no longer requires use of its own cloud services. In addition, Beeper is introducing premium offerings that provide access to more accounts than its free tier and include power-user features like reminders, the ability to send messages later, an incognito mode to read messages without marking them read, AI voice note transcriptions, and more.

Now owned by WordPress.com maker Automattic, which bought Beeper for $125 million in 2024, the app has almost entirely integrated with competitor Texts.com, which Automattic also acquired the year prior for $50 million.

With a combined 30-person team (including contractors) and now operating under the Beeper brand, the messaging app supports WhatsApp, Instagram, Messenger, X, Telegram, Signal, Matrix, Slack, Google Chat, Discord, LinkedIn, and Google Messages (SMS/RCS). On Mac computers only, Beeper can also connect users with their iMessage chats, though Apple has shut down this access in prior versions.

Image Credits:Automattic/Beeper

The overall goal, according to Automattic, is to simplify the problem of having too many messaging apps to keep up with, while also keeping those chats secure.

The app previously first connected with Beeper Cloud before communicating with the messaging network, said Beeper CEO Kishan Bagaria. While that system remains the default, users will now have the option of switching to Beeper on device, which will see the app connecting directly to the messaging network and skipping the middleman.

“That ensures that end-to-end encryption is preserved and your privacy is as good as the official app,” Bagaria told TechCrunch in an interview ahead of the app’s relaunch. Whether the companies involved will appreciate having their own apps bypassed, however, remains to be seen.

“We have good relationships with some of these"
India eyes global quantum computer push — and QpiAI is its chosen vehicle,"QpiAI, an Indian startup that integrates AI and quantum computing for enterprise use cases, has raised $32 million in a new funding round co-led by the Indian government.",https://techcrunch.com/2025/07/16/india-eyes-global-quantum-computer-push-and-qpiai-is-its-chosen-vehicle/,TechCrunch,,Technology,"QpiAI, an Indian startup that claims to integrate AI and quantum computing for enterprise use cases, has raised $32 million in a new funding round co-led by the Indian government as the company aims to expand its presence and develop utility-scale quantum computers for markets around the world.

The Indian government’s $750 million National Quantum Mission has co-led QpiAI’s all-equity Series A round, alongside Avataar Ventures, at a post-money valuation of $162 million.

The funding reflects India’s broader push to establish itself as a quantum computing power. Launched in 2023, the National Quantum Mission is an Indian government initiative that views quantum computing as both an economic opportunity and a national security imperative. The program aims to help develop intermediate-scale quantum computers with 50-1,000 physical qubits within eight years across platforms including superconducting and photonics. It also targets the development of satellite-based quantum communications, inter-city quantum distribution, multi-node quantum networks, magnetometers, and the design and synthesis of quantum materials, including superconductors, semiconductor structures, and topological materials for quantum device fabrication.

QpiAI is one of eight startups selected by the National Quantum Mission, each receiving an initial grant of up to $3.5 million. Among these companies, the Bengaluru-headquartered startup, which has subsidiaries in the U.S. and Finland, says it has built India’s first full-stack quantum computer, called QpiAI-Indus, which it launched in April with 25 superconducting qubits.

Founded in 2019, QpiAI says it integrates quantum computing and AI to provide optimization capabilities in areas such as manufacturing, industrial, transportation, finance, pharma, and materials. The startup says it has developed specialized software, along with its proprietary hardware, to support real-world quantum applications in fields such as materials science and drug discov"
This $55 tool can help you pick smarter stocks,Get an extra 20% off Sterling Stock Picker with code SAVE20.,https://mashable.com/deals/july-17-sterling-stock-picker,Mashable,,Technology,"Get lifetime access to this stock picker for up to 85% off.

Get lifetime access to this stock picker for up to 85% off. Credit: Sterling Stock Picker

TL;DR: Get lifetime access to Sterling Stock Picker for $55.20 with code SAVE20.

If you want to get the most out of the stock market, you either have to pay with your time or your money. If you have a full-time job, chances are you won’t have the opportunity to stay informed on the state of the market, but hiring a financial advisor can come with unseen fees and a loss of control over your investments.

Sterling Stock Picker makes strategic investing easy, regardless of past experience or knowledge. Get lifetime access for only $55.20 when you save an extra 20% with code SAVE20.

Mashable Trend Report Decode what’s viral, what’s next, and what it all means. Sign up for Mashable’s weekly Trend Report newsletter. Loading... Sign Me Up By clicking Sign Me Up, you confirm you are 16+ and agree to our Terms of Use and Privacy Policy Thanks for signing up!

With Sterling Stock Picker, you get access to Finley, an AI-powered financial coach. Using real-time data, Finley can offer strategic investment advice or answer any questions about your portfolio and the current state of the market. Answer questions about your preferences surrounding risk tolerance and your overall investment goals to receive a personalized portfolio and risk analysis with recommendations for high-potential stocks.

Especially important for beginner investors is Finley’s ability to break down complex financial topics into in-depth, absorbable explanations. Save an extra 20% on Sterling Stock Picker with code SAVE20 and secure a lifetime membership to build your portfolio while you build basic knowledge of the stock market for just $55.20.

StackSocial prices subject to change."
Filmmaker Mode on the LG C4 TV changed the way I watch movies forever,"LG C4 TV review. Not only a high-quality 4K OLED display, but comes with Filmmaker Mode that allows you to watch films as the director intended.",https://mashable.com/article/lg-c4-review,Mashable,,Technology,"As someone who spends a lot of time in front of a TV, I want to make sure the screen I buy is a good one. If you, like me, play a lot of games or watch plenty of movies, I think it's worth investing in a nice model that'll provide you with a high quality display for your favorite activities.

Recently, I made the decision to upgrade to the LG C4 TV, and it's been a fantastic jump in quality. My movie nights, in particular, have never been better.

Sure, the newer LG C5 may already be out, but the LG C4 is a TV that's still worth every cent. I have the 55-inch model, and it's a great size for my apartment. It's also very slim, which makes it look nice and sleek when set up against the wall.

You May Also Like

More importantly, the C4 boasts a wide variety of features that make it a worthy pickup. Its 4K OLED display offers up vibrant colors and contrasts alongside an incredible amount of detail, which is a treat for the eyes. And your ears can enjoy stellar sound quality thanks to Dolby Atmos audio as well, making for an enjoyably immersive experience. But for me, one of the best features this TV boasts is Filmmaker Mode.

I'm a big movie fan, and not only do I love to feel completely absorbed in what I'm watching, but it helps when I can watch a movie the way that the director intended for it to be seen. Filmmaker Mode does exactly that, and I think this is one of the standout features of the LG C4, something that certainly makes it worth picking up if you've been on the hunt for something that can elevate your movie nights.

Mashable Light Speed Want more out-of-this world tech, space and science stories? Sign up for Mashable's weekly Light Speed newsletter. Loading... Sign Me Up By clicking Sign Me Up, you confirm you are 16+ and agree to our Terms of Use and Privacy Policy Thanks for signing up!

Movie nights, made better

Of course, it's not mandatory to watch movies in Filmmaker Mode. There are many picture settings available so you can tailor the image to you"
Titan’s methane lakes could foster an early step in the creation of life,"A new NASA study shows that Titan's methane lakes could form ""vesicles,"" a crucial early step in the development of living cells on Earth.",https://mashable.com/article/nasa-titan-saturn-moon-vesicle-life-conditions,Mashable,,Technology,"NASA's Cassini spacecraft captures an infrared view of Saturn moon Titan during a November 2015 flyby in this composite image. Credit: NASA / JPL / University of Arizona / University of Idaho

Saturn’s largest moon, Titan , appears to have the right ingredients and conditions for a certain kind of tiny bubble to form that has the potential to lead to alien life.

These microscopic bubbles — called vesicles — could naturally occur in Titan's methane lakes, according to a new NASA study. On Earth, the structures are considered a crucial early step in the development of living cells. On Titan, a moon 880 million miles away in space , they could hint at chemistry capable of mimicking an Earth-like path to simple life-forms.

Titan is no ordinary moon. It’s the only place besides Earth in the solar system known to have a thick atmosphere, active weather , and liquid on its surface. But instead of water, Titan’s lakes and seas are filled with methane and ethane . They cycle through the atmosphere, forming clouds and oily rain that shape the landscape below, similar to Earth’s water cycle, but at temperatures hundreds of degrees below freezing.

You May Also Like

Scientists have long wondered whether Titan’s liquids could also provide an environment for the chemical building blocks of life — or rather, the kind of life people know about.

""The existence of any vesicles on Titan would demonstrate an increase in order and complexity, which are conditions necessary for the origin of life,"" said NASA scientist Conor Nixon in a statement .

Mashable Light Speed Want more out-of-this world tech, space and science stories? Sign up for Mashable's weekly Light Speed newsletter. Loading... Sign Me Up By clicking Sign Me Up, you confirm you are 16+ and agree to our Terms of Use and Privacy Policy Thanks for signing up!

SEE ALSO: Two black holes merged in outer space and created something colossal

From upper left to lower right, Titan's methane lakes get coated in a film of amphiph"
How to watch Womens Euro 2025 online for free,How to watch Women's Euro 2025 for free. Live stream Women's Euro 2025 for free from anywhere in the world.,https://mashable.com/article/womens-euro-2025-live-stream-for-free,Mashable,,Technology,"TL;DR: Access free live streams of Women's Euro 2025 from anywhere in the world with ExpressVPN.

This has already been a special summer for sport. The schedule has been stacked with events including the Club World Cup, Lions Tour, and Wimbledon, and now Women's Euro 2025 is adding something new to the mix. We didn't really need more live sport this summer, but are we complaining? Absolutely not. We're greedy for more of the good stuff.

If you want to watch Women's Euro 2025 for free from anywhere in the world, we have all the information you need.

You May Also Like

What is Women's Euro?

The European Women's Championship (Women's Euros) is the main competition in women's association football between national teams of the UEFA confederation. The competition is the women's equivalent of the UEFA European Championship, featuring 16 European women's national teams competing in a group stage followed by knockout fixtures.

The defending champions are England.

When is Women's Euro 2025?

Women's Euro 2025 is the 14th edition of the tournament. This year's competition takes place from July 2-27.

Mashable Top Stories Stay connected with the hottest stories of the day and the latest entertainment news. Sign up for Mashable's Top Stories newsletter Loading... Sign Me Up By clicking Sign Me Up, you confirm you are 16+ and agree to our Terms of Use and Privacy Policy Thanks for signing up!

How to watch Women's Euro 2025 for free

There are a number of free streaming platforms offering coverage of Women's Euro 2025:

Austria — ORF

Belgium — RTBF and VRT

France — TF1

Germany — ARD and ZDF

Italy — RAI

Netherlands — NOS

Spain — RTVE

UK — BBC iPlayer and ITVX (recommended)

These free streaming services are geo-restricted, but anyone can access these free live streams with a VPN. These handy tools can hide your real IP address (digital location) and connect you to secure servers in other countries, meaning you can access free live streams of Women's Euro 2025 from anyw"
I’m testing Perplexity’s new AI browser Comet. Here are 3 features I tried right away.,Perplexity's new Comet browser has a built-in AI assistant for agentic shopping and summarization features. Here are the ways I'm trying it out.,https://mashable.com/article/perplexity-ai-browser-comet-features-to-try,Mashable,,Technology,"What makes an AI browser better than a regular browser? With Perplexity's Comet, that's what I'm trying to find out.

Last week, AI search engine company Perplexity launched its highly anticipated browser, which uses the Perplexity search engine and comes with a built-in AI assistant. As AI models become more advanced with chain-of-thought reasoning for handling complex tasks, they're capable of more agentic, or autonomous, work. This is a natural fit for web browsers, which are essentially the gateway to our online lives. An AI web browser like Comet can theoretically do much more than a chatbot tied to a single page or app, enabling actions across multiple tabs and platforms.

Perplexity's Comet browser is an early entry, alongside Arc's Dia browser, that seeks to create a new paradigm for browsing and shopping with AI. (OpenAI is also reportedly about to launch its own AI browser). The ability to automate and summarize our experience online has become a major focal point for the AI industry, since it offers the ostensible purpose of speeding up tasks and easing our cognitive load.

You May Also Like

And the timing for introducing a new browser to compete with Google Chrome and Apple Safari couldn’t be better. Google might be forced to sell Chrome after a huge antitrust loss. The ruling also impacts Apple, which received $20 billion a year to make Google the default search engine for Safari. Apple already seems to be making changes to its search offerings, including a potential partnership with Perplexity. That’s all to say there’s suddenly a lot more opportunity for newcomers like Perplexity to shake up the market.

Somewhat ironically, Comet runs on Chromium, Google's open-source browser service. So when I got access, switching over my extensions and settings was pretty seamless. With everything transferred and set up, I dug in to see what Comet can do. I should note that I do have some serious privacy concerns, which I'll explore in a follow-up article

Here a"
Watch Our Livestream Replay: Inside the AI Copyright Battles,"Curious about generative AI and copyright? On July 16, our writers answered your questions about this critical topic.",https://www.wired.com/story/livestream-ai-copyright-battles/,Wired,,Technology,"What's going on right now with the copyright battles over artificial intelligence? Many lawsuits regarding generative AI’s training materials were initially filed back in 2023, with decisions just now starting to trickle out. Whether it’s Midjourney generating videos of Disney characters, like Wall-E brandishing a gun, or an exit interview with a top AI lawyer as he left Meta, WIRED senior writer Kate Knibbs has been following this fight for years.

Watch the replay of WIRED’s subscriber-only livestream from July 16, hosted by Reece Rogers with Kate Knibbs. And see all of WIRED's livestreams here."
